review,reasoning,sentiment_score,politeness_score
"The paper introduces a time dependent recommender system based on point processes parametrized by time dependent user and item latent representations. The later are modeled as coupled – autoregressive processes – i.e. the representation of a user/item changes when he interacts with an item/user, and is a function of both the user and the item representations before time t. This is called coevolution here and the autoregressive process is called recurrent NN. The model may also incorporate heterogeneous inputs. Experiments are performed on several datasets, and the model is compared with different baselines. There are several contributions in the paper: 1) modeling recommendation via parametrized point processes where the parameter dynamics are modeled by latent user/item representations, 2) an optimization algorithm for maximizing the likelihood of this process, with different technical tricks that seem to break its intrinsic complexity, 3) evaluation experiments for time dependent recommendation. The paper by the same authors (NIPS 2016) describes a similar model of continuous time coevolution, and a similar evaluation. The difference lies in the details of the model: the point process model is not the same and of the latent factor dynamic model is slightly different, but the modeling approach and the arguments are exactly the same. By the end, one does not know what makes this model perform better than the one proposed in NIPS, is it the choice for the process, the new parametrization? Both are quite similar. There is no justification on the choice of the specific form of the point process in the two papers. Did the authors tried other forms as well? The same remark applies for the form of the dynamical process: the non-linearity used for the modeling of the latent user/item vectors here is limited to a sigmoid function, which probably does not change much w.r.t. a linear model, but there is no evidence of the role of this non linearity in the paper. Note that there are some inconsistencies between the results in the two papers. Concerning the evaluation, the authors introduce two criteria. I did not get exactly how they evaluate the item recommendation: it is mentioned that at each time t, the model predicts the item the user will interact with. Do you mean, the next item the user will interact with after time t? For the time prediction, why is it a relevant metric for recommendation? A comparison of the complexity, or execution time of the different methods would be helpful. The complexity of your method is apparently proportional to #items*#users, what are the complexity limits of your methods. Overall, the paper is quite nice and looks technically sound, albeit many details are missing. On the other hand, I have a mixed feeling because of the similarity with NIPS paper. The authors should have make a better work at convincing us that this is not a marginal extension of previous work by the authors. I was not convinced either by the evaluation criteria and there is no evidence that the model can be used for large datasets.","The reviewer acknowledges the technical soundness of the paper and finds the contributions valuable. However, they express concerns about the lack of novelty compared to the authors' previous work and raise several questions about the model's justification and evaluation. The language used is critical but professional and maintains a respectful tone. Therefore, the sentiment is moderately positive, leaning towards neutral due to the concerns raised.",40,60
"This paper proposes the RIMs that unrolls variational inference procedure. The author claims that the novelty lies in the separation of the model and inference procedure, making the MAP inference as an end-to-end approach. The effectiveness is shown in image restoration experiments. While unrolling the inference is not new, the author does raise an interesting perspective towards the `model-free* configuration, where model and inference are not separable and can be learnt jointly. However I do not quite agree the authors* argument regarding [1] and [2]. Although both [1] and [2] have pre-defined MAP inference problem. It is not necessarily that a separate step is required. In fact, both do not have either a pre-defined prior model or an explicit prior evaluation step as shown in Fig. 1(a). I believe that the implementation of both follows the same procedure as the proposed, that could be explained through Fig. 1(c). That is to say, the whole inference procedure eventually becomes a learnable neural network and the energy is implicitly defined through learning the parameters. Moreover, the RNN block architecture (GRU) and non-linearity (tanh) restrict the flexibility and implicitly form the inherent family of variational energy and inference algorithm. This is also similar with [1] and [2]. Based on that fact, I have the similar feeling with R1 that the novelty is somewhat limited. Also some discussions should be added in terms of the architecture and nonlinearity that you have chosen.","The reviewer acknowledges the interesting perspective of the paper and its contribution to model-free configurations. However, they disagree with the authors' arguments and find the novelty somewhat limited. The reviewer maintains a neutral yet critical tone throughout the review.",10,50
"This paper presents a modified gated RNN caled GRU-D that deals with time series which display a lot of missing values in their input. They work on two fronts. The first deals with the missing inputs directly by using a learned convex combination of the previous available value (forward imputation) and the mean value (mean imputation). The second includes dampening the recurrent layer not unlike a second reset gate, but parametrized according to the time elapsed since the last available value of each attributes. Positives ------------ - Clear definition of the task (handling missing values for classification of time series) - Many interesting baselines to test the new model against. - The model presented deals with the missing values in a novel, ML-type way (learn new dampening parameters). - The extensive tests done on the datasets is probably the greatest asset of this paper. Negatives ------------- - The paper could use some double checking for typos. - The Section A.2.3 really belongs in the main article as it deals with important related works. Swap it with the imprecise diagrams of the model if you need space. - No mention of any methods from the statistics litterature. Here are the two main points of this review that informs my decision: 1. The results, while promising, are below expectations. The paper hasn’t been able to convince me that GRU-simple (without intervals) isn’t just as well-suited for the task of handling missing inputs as GRU-D. In the main paper, GRU-simple is presented as the main baseline. Yet, it includes a lot of extraneous parameters (the intervals) that, according to Table 5, probably hurts the model more than it helps it. Having a third of it’s parameters being of dubious value, it brings the question of the fairness of the comparison done in the main paper, especially since in the one table where GRU-simple (without intervals) is present, GRU-D doesn’t significantly outperforms it. 2. My second concern, and biggest, is with some claims that are peppered through the paper. The first is about the relationship with the presence rate of data in the dataset and the diagnostics. I might be wrong, but that only indicates that the doctor in charge of that patient requested the relevant analyses be done according to the patient’s condition. That would mean that an expert system based on this data would always seem to be one step behind. The second claim is the last sentence of the introduction, which sets huge expectations that were not met by the paper. Another is that “simply concatenating masking and time interval vectors fails to exploit the temporal structure of missing values” is unsubstantiated and actually disproven later in the paper. Yet another is the conclusion that since GRU models displayed the best improvement between a subsample of the dataset and the whole of it means that the improvement is going to continue to grow as more data is added. This fails to consider that non-GRU models actually started with much better results than most GRU ones. Lastly is their claim to capture informative missingness by incorporating masking and time intervals directly inside the GRU architecture. While the authors did make these changes, the fact that they also concatenate the mask to the input, just like GRU-simple (without intervals), leads me to question the actual improvement made by GRU-D. Given that, while I find that the work that has been put into the paper is above average, I wouldn’t accept that paper without a reframing of the findings and a better focus on the real contribution of this paper, which I believe is the novel way to parametrize the choice of imputation method.","The reviewer highlights both positive aspects (clear task definition, interesting baselines, novel approach, extensive testing) and negative aspects (typos, structural issues, unsubstantiated claims, potentially misleading results). While acknowledging the paper's effort, the reviewer expresses concerns about the validity of some conclusions and the overall impact of the proposed GRU-D model. The tone is critical but professional, focusing on specific areas for improvement. The reviewer's recommendation seems to be 'major revisions' rather than outright rejection.",20,60
"This paper presents a new type of language model that treats entity references as latent variables. The paper is structured as three specialized models for three applications: dialog generation with references to database entries, recipe generation with references to ingredients, and text generation with coreference mentions. Despite some opaqueness in details that I will discuss later, the paper does a great job making the main idea coming through, which I think is quite interesting and definitely worth pursuing further. But it seems the paper was rushed into the deadline, as there are a few major weaknesses. The first major weakness is that the claimed latent variables are hardly latent in the actual empirical evaluation. As clarified by the authors via pre-review QAs, all mentions were assumed to be given to all model variants, and so, it would seem like an over-claim to call these variables as latent when they are in fact treated as observed variables. Is it because the models with latent variables were too difficult to train right? A related problem is the use of perplexity as an evaluation measure when comparing reference-aware language models to vanilla language models. Essentially the authors are comparing two language models defined over different event space, which is not a fair comparison. Because mentions were assumed to be given for the reference-aware language models, and because of the fact that mention generators are designed similar to a pointer network, the probability scores over mentions will naturally be higher, compared to the regular language model that needs to consider a much bigger vocabulary set. The effect is analogous to comparing language models with aggressive UNK (and a small vocabulary set) to a language models with no UNK (and a much larger vocabulary set). To mitigate this problem, the authors need to perform one of the following additional evaluations: either assuming no mention boundaries and marginalizing over all possibilities (treating latent variables as truly latent), or showing other types of evaluation beyond perplexity, for example, BLEU, METEOR, human evaluation etc on the corresponding generation task. The other major weakness is writing in terms of technical accuracy and completeness. I found many details opaque and confusing even after QAs. I wonder if the main challenge that hinders the quality of writing has something to do with having three very specialized models in one paper, each having a lot of details to be worked out, which may have not been extremely important for the main story of the paper, but nonetheless not negligible in order to understand what is going on with the paper. Perhaps the authors can restructure the paper so that the most important details are clearly worked out in the main body of the paper, especially in terms of latent variable handling — how to make mention detection and conference resolution truly latent, and if and when entity update helps, which in the current version is not elaborated at all, as it is mentioned only very briefly for the third application (coreference resolution) without any empirical comparisons to motivate the update operation.","The reviewer finds the core idea interesting and worth pursuing, demonstrated by phrases like ""quite interesting and definitely worth pursuing further"". However, they also list several major weaknesses, indicating a need for significant improvement.  The reviewer is critical of the paper's rushed feel and lack of clarity, using phrases like ""a few major weaknesses"", ""hardly latent"", ""over-claim"", ""not a fair comparison"", ""opaque and confusing"". Due to the mix of positive interest and strong criticism, the sentiment leans slightly negative. The language is direct and critical but maintains academic professionalism, avoiding overtly rude or informal language.",-20,60
"The paper experimentally investigates a slightly modified version of label smoothing technique for neural network training, and reports results on various tasks. Such smoothing idea is not new, but was not investigated previously in wide range of machine learning tasks. Comments: The paper should report the state-of-the-art results for speech recognition tasks (TIMIT, WSJ), even if models are not directly comparable. The error back-propagation of label smoothing through softmax is straightforward and efficient. Is there an efficient solution for BP of the entropy smoothing through softmax? Although the classification accuracy could remain the same, the model will not estimate the true posterior distribution with this kind of smoothing. This might be an issue in complex machine learning problems where the decision is made on higher level and based on the posterior estimations, e.g. language models in speech recognition. More motivation is necessary for the proposed smoothing.","The review starts with a neutral statement, acknowledging the paper's investigation of a slightly modified technique and its application across various tasks. However, the reviewer then poses several questions and requests for improvement, indicating that the paper in its current state might not be ready for publication. The questions, while critical, are framed constructively and suggest directions for strengthening the paper. The language avoids harsh or negative vocabulary, maintaining a professional and objective tone.",20,70
"This paper proposes a method for transfer learning, i.e. leveraging a network trained on some original task A in learning a new task B, which not only improves performance on the new task B, but also tries to avoid degradation in performance on A. The general idea is based on encouraging a model trained on A, while training on the new task B, to match fake targets produced by the model itself but when it is trained only on the original task A. Experiments show that this method can help in improving the result on task B, and is better than other baselines, including standard fine-tuning. General comments/questions: - As far as I can tell, there is no experimental result supporting the claim that your model still performs well on the original task. All experiments show that you can improve on the new task only. - The introduction makes a strong statements about the distilling logical rule engine into a neural network, which I find a bit misleading. The approach in the paper is not specific to transferring from logical rules (as stated in the Sec 2) and is simply relying on the rule engine to provide labels for unlabelled data. - One of the obvious baselines to compare with your approach is standard multi-task learning on both tasks A and B together. That is, you train the model from scratch on both tasks simultaneously (which sharing parameters). It is not clear this is the same as what is referred to in Sec. 8 as *joint training*. Can you please explain more clearly what you refer to as joint training? - Why can*t we find the same baselines in both Table 2 and Table 3? For example Table 2 is missing *joint training*, and Table 3 is missing GRU trained on the target task. - While the idea is presented as a general method for transfer learning, experiments are focused on one domain (sentiment analysis on SemEval task). I think that either experiments should include applying the idea on at least one other different domain, or the writing of the paper should be modified to make the focus more specific to this domain/task. Writing comments - The writing of the paper in general needs some improvement, but more specifically in the experiment section, where experiment setting and baselines should be explained more concisely. - Ensemble methodology paragraph does not fit the flow of the paper. I would rather explain it in the experiments section, rather than including it as part of your approach. - Table 1 seems like reporting cross-validation results, and I do not think is very informative to general reader.","The review is critical of the paper, pointing out several flaws in the experiments and presentation. While it acknowledges the potential of the proposed method, the reviewer raises significant concerns that suggest the paper is not ready for publication in its current form. The language used is direct and critical, but maintains a professional and objective tone. There are no personal attacks or disrespectful remarks. The reviewer provides constructive feedback, suggesting specific improvements and additional experiments.",-40,60
"The paper studies the impact of using customized number representations on accuracy, speed, and energy consumption of neural network inference. Several standard computer vision architectures including VGG and GoogleNet are considered for the experiments, and it is concluded that floating point representations are preferred over fixed point representations, and floating point numbers with about 14 bits are sufficient for the considered architectures resulting in a small loss in accuracy. The paper provides a nice overview of floating and fixed point representations and focuses on an important aspect of deep learning that is not well studied. There are several aspects of the paper that could be improved, but overall, I am leaned toward weak accept assuming that the authors address the issues below. 1- The paper is not clear that it is only focusing on neural network inference. Please include the word *inference* in the title / abstract to clarify this point and mention that the findings of the paper do not necessarily apply to neural network training as training dynamics could be different. 2- The paper does not discuss the possibility of adopting quantization tricks during training, which may result in the use of fewer bits at inference. 3- The paper is not clear whether in computing the running time and power consumption, it includes all of the modules or only multiply-accumulate units? Also, how accurate are these numbers given different possible designs and the potential difference between simulation and production? Please elaborate on the details of simulation in the paper. 4- The whole discussion about *efficient customized precision search* seem unimportant to me. When such important hardware considerations are concerned, even spending 20x simulation time is not that important. The exhaustive search process could be easily parallelized and one may rather spend more time at simulation at the cost of finding the exact best configuration rather than an approximation. That said, weak configurations could be easily filtered after evaluating just a few examples. 5- Nvidia*s Pascal GP100 GPU supports FP16. This should be discussed in the paper and relevant Nvidia papers / documents should be cited. More comments: - Parts of the paper discussing *efficient customized precision search* are not clear to me. - As future work, the impact of number representations on batch normalization and recurrent neural networks could be studied.","The reviewer provides a generally positive overview of the paper, stating that it ""provides a nice overview"" and focuses on an important and understudied aspect. They are ""leaned toward weak accept,"" indicating a positive sentiment overall. However, they also list several areas for improvement, suggesting the paper is not perfect. Therefore, the sentiment is likely on the positive side but not overly enthusiastic. The language used is constructive and professional throughout, suggesting a polite and respectful tone.",60,80
"This paper proposes a simple domain adaptation technique in which batch normalization is performed separately in each domain. Pros: The method is very simple and easy to understand and apply. The experiments demonstrate that the method compares favorably with existing methods on standard domain adaptation tasks. The analysis in section 4.3.2 shows that a very small number of target domain samples are needed for adaptation of the network. Cons: There is little novelty -- the method is arguably too simple to be called a “method.” Rather, it’s the most straightforward/intuitive approach when using a network with batch normalization for domain adaptation. The alternative -- using the BN statistics from the source domain for target domain examples -- is less natural, to me. (I guess this alternative is what’s done in the Inception BN results in Table 1-2?) The analysis in section 4.3.1 is superfluous except as a sanity check -- KL divergence between the distributions should be 0 when each distribution is shifted/scaled to N(0,1) by BN. Section 3.3: it’s not clear to me what point is being made here. Overall, there’s not much novelty here, but it’s hard to argue that simplicity is a bad thing when the method is clearly competitive with or outperforming prior work on the standard benchmarks (in a domain adaptation tradition that started with “Frustratingly Easy Domain Adaptation”). If accepted, Sections 4.3.1 and 3.3 should be removed or rewritten for clarity for a final version.","The review acknowledges the simplicity and effectiveness of the proposed method as its strengths, comparing it favorably to existing methods. However, it also points out the lack of novelty as a significant drawback, suggesting the method is almost too straightforward. The reviewer suggests removing or clarifying certain sections, indicating a need for improvement but not a complete rejection. Overall, the tone is critical but professional and provides constructive feedback.",20,60
