review,reasoning,sentiment_score,politeness_score
"This paper trains a generative model of image patches, where dictionary elements undergo gated linear transformations before being combined. The transformations are motivated in terms of Lie group operators, though in practice they are a set of fixed linear transformations. This is motivated strongly in terms of learning a hierarchy of transformations, though only one layer is used in the experiments (except for a toy case in the appendix). I like the motivation for this algorithm. The realization seems very similar to a group or block sparse coding implementation. I was disappointed by the restriction to linear transformations. The experiments were all toy cases, demonstrating that the algorithm can learn groups of Gabor- or center surround-like features. They would have been somewhat underpowered five years ago, and seemed extremely small by today*s standards. Specific comments: Based on common practices in ML literature, I have a strong bias to think of as inputs and as network weights. Latent variables are often or . Depending on your target audience, I would suggest permuting your choice of symbols so the reader can more quickly interpret your model. nit: number all equations for easier reference sec 2.2 -- It*s weird that the transformation is fixed, but is still written as a function of x. sec 2.3 -- The updated text here confuses me actually. I had thought that you were using a fixed set of linear transformations, and were motivating in terms of Lie groups, but were not actually taking matrix exponentials in your algorithm. The equations in the second half of this section suggest you are working with matrix exponentials though. I*m not sure which direction I*m confused in, but probably good to clarify the text either way. BTW -- there*s another possible solution to the local minima difficulty, which is the one used in Sohl-Dickstein, 2010. There, they introduce blurring operators matched to each transformation operator, and gradient descent can escape local minima by detouring through coarser (more blurred) scales. sec 3.2 -- I believe by degrees of freedom you mean the number of model parameters, not the number of latent coefficients that must be inferred? Should make this more clear. Is it more appropriate to compare reconstruction error while matching number of model parameters, or number of latent variables? I wonder if a convolutional version of this algorithm would be practical / would make it more suited as a generative model of whole images. ==== post rebuttal update Thank you for taking the time to write the rebuttal! I have read it, but it did not significantly effect my rating.","The reviewer expresses interest in the paper's motivation (""I like the motivation for this algorithm"") but finds the experiments lacking and too simplistic for current standards. They also raise several questions and point out areas of confusion. Overall, the tone is critical but professional and not rude. Therefore, the sentiment leans slightly negative due to the concerns raised, but not overwhelmingly so.",-20,50
"The method overall seems to be a very interesting structural approach to variational autoencoders, however it seems to lack motivation as well as the application areas sufficient to prove its effectiveness. I see the attractiveness of using structural information in this context and I find it more intuitive than using a flat sequence representation, especially when there is a clear structure in the data. However experimental results seem to fail to be convincing in that regard. One issue is the lack of a variety of applications in general, the experiments seem to be very limited in that regard, considering that the paper itself speaks about natural language applications. It would be interesting to use the latent representations learned with the model for some other end task and see how much it impacts the success of that end task compared to various baselines. In my opinion, the paper has a potentially strong idea however in needs stronger results (and possibly in a wider variety of applications) as a proof of concept.","The reviewer finds the core idea interesting and potentially strong, but is not fully convinced due to limited application and results. They find the approach intuitive and see its value, making the sentiment more positive. The language avoids harsh criticism and maintains a respectful tone, suggesting politeness. However, the lack of stronger results pulls the sentiment down from fully positive.",50,70
"This paper proposes a method that attempts to *understand* what is happening within a neural network by using linear classifier probes which are inserted at various levels of the network. I think the idea is nice overall because it allows network designers to better understand the representational power of each layer in the network, but at the same time, this works feels a bit rushed. In particular, the fact that the authors did not provide any results in *real* networks, which are used to win competitions makes the results less strong, since researchers who want to created competitive network architectures don*t have enough evidence from this work to decides whether they should use it or not. Ideally, I would encourage the authors to consider continuing this line of research and show how to use the information given by these linear classifiers to construct better network architectures. Unfortunately, as is, I don*t think we have enough novelty to justify accepting this work in the conference.","The reviewer finds the idea ""nice"" and interesting, but ultimately sees the work as ""rushed"" and lacking ""enough novelty"" due to the absence of results in real-world applications. The reviewer suggests further research to strengthen the work. This indicates a lukewarm response leaning towards the negative due to the lack of strong results.",-20,70
"This paper makes three main methodological contributions: - definition of Neural Feature (NF) as the pixel average of the top N images that highly activation a neuron - ranking of neurons based on color selectivity - ranking of neurons based on class selectivity The main weaknesses of the paper are that none of the methodological contributions are very significant, and no singularly significant result arises from the application of the methods. However, the main strengths of the paper are its assortment of moderately-sized interesting conclusions about the basic behavior of neural nets. For example, a few are: - “Indexing on class selectivity neurons we found highly class selective neurons like digital-clock at conv2, cardoon at conv3 and ladybug at conv5, much before the fully connected layers.” As far as I know, this had not been previously reported. - Color selective neurons are found even in higher layers. (25% color selectivity in conv5) - “our main color axis emerge (black-white, blue-yellow, orange-cyan and cyan- magenta). Curiously, these two observations correlate with evidences in the human visual system (Shapley & Hawken (2011)).” Great observation! Overall, I’d recommend the paper be accepted, because although it’s difficult to predict at this time, there’s a fair chance that one of the “smaller conclusions” would turn out to be important in hindsight a few years hence. Other small comments: - The cite for “Learning to generate chairs…” is wrong (first two authors combined resulting in a confusing cite) - What exactly is the Color Selectivity Index computing? The Opponent Color Space isn’t well defined and it wasn’t previously familiar to me. Intuitively it seems to be selecting for units that respond to a constant color, but the highest color selectivity NF in Fig 5 i for a unit with two colors, not one. Finally, the very last unit (lowest color selectivity) is almost the same edge pattern, but with white -> black instead of blue -> orange. Why are these considered to be so drastically different? This should probably be more clearly described. - For the sake of argument, imagine a mushroom sensitive neuron in conv5 that fires highly for mushrooms of *any* color but not for anything else. If the dataset contains only red-capped mushrooms, would the color selectivity index for this neuron be high or low? If it is high, it’s somewhat misleading because the unit itself actually isn’t color selective; the dataset just happens only to have red mushrooms in it. (It’s a subtle point but worth considering and probably discussing in the paper)","The reviewer acknowledges weaknesses in the paper, stating the contributions are not ""very significant"" and results not ""singularly significant."" However, they find the conclusions interesting, highlighting several examples and calling some ""great observations."" They ultimately recommend acceptance based on the potential future importance of the findings. The language is balanced and professional throughout.",60,80
"The authors explore whether the halting time distributions for various algorithms in various settings exhibit *universality*, i.e. after rescaling to zero mean and unit variance, the distribution does not depend on stopping parameter, dimensionality and ensemble. The idea of the described universality is very interesting. However I see several shortcomings in the paper: In order to be of practical relevance, the actual stopping time might be more relevant than the scaled one. The discussion of exponential tailed halting time distributions is a good start, but I am not sure how often this might be actually helpful. Still, the findings in the paper might be interesting from a theoretical point of view. Especially for ICLR, I think it would have been more interesting to look into comparisons between stochastic gradient descent, momentum, ADAM etc on different deep learning architectures. Over which of those parameters does universality hold?. How can different initializations influence the halting time distribution? I would expect a sensible initialization to cut of part of the right tail of the distribution. Additionally, I found the paper quite hard to read. Here are some clarity issues: - abstract: *even when the input is changed drastically*: From the abstract I*m not sure what *input* refers to, here - I. Introduction: *where the stopping condition is, essentially, the time to find the minimum*: this doesn*t seem to make sense, a condition is not a time. I guess the authors wanted to say that the stopping condition is that the minimum has been reached? - I.1 the notions of dimension N, epsilon and ensemble E are introduced without any clarification what they are. From the later parts of the paper I got some ideas and examples, but here it is very hard to understand what these parameters should be (just some examples would be already helpful) - I.3 *We use x^ell for ell in Z={1, dots, S} where Z is a random sample from of training samples* This formulation doesn*t make sense. Either Z is a random sample, or Z={1, ..., S}. - II.1 it took me a long time to find the meaning of M. As this parameter seems to be crucial for universality in this case, it would be very helpful to point out more explicitly what it refers to.","The reviewer acknowledges the interesting idea but raises several concerns about the paper's practical relevance and clarity. They find the paper more theoretical and suggest alternative directions relevant to ICLR's focus. The reviewer also lists specific clarity issues, indicating a struggle to understand key concepts and terminology. The tone is critical but professional, suggesting improvements without resorting to personal attacks.",20,60
"In this paper, the authors propose to pretrain the encoder/decoder of seq2seq models on a large amount of unlabeled data using a LM objective. They obtain improvements using this technique on machine translation and abstractive summarization. While the effectiveness of pretraining seq2seq models has been known among researchers and explored in a few papers (e.g. Zoph et al. 2016, Dai and Le 2015), I believe this is the first paper to pretrain using a LM for both the encoder/decoder. The technique is simple, but the gains are large (e.g. +2.7 BLEU on NMT). In addition, the authors perform extensive ablation studies to analyze where the performance is coming from. Hence, I think this paper should be accepted.","The reviewer explicitly recommends acceptance, uses positive language like ""simple, but the gains are large"", and praises the thoroughness of the ablation studies. There is no negative phrasing used towards the paper. Thus, the sentiment is highly positive and the language very polite.",90,100
"This paper conducts a comprehensive series of experiments on vocabulary selection strategies to reduce the computational cost of neural machine translation. A range of techniques are investigated, ranging from very simple methods such as word co-occurences, to the relatively complex use of SVMs. The experiments are solid, comprehensive and very useful in practical terms. It is good to see that the best vocabulary selection method is very effective at achieving a very high proportion of the coverage of the full-vocabulary model (fig 3). However, I feel that the experiments in section 4.3 (vocabulary selection during training) was rather limited in their scope - I would have liked to see more experiments here. A major criticism I have with this paper is that there is little novelty here. The techniques are mostly standard methods and rather simple, and in particular, there it seems that there is not much additional material beyond the work of Mi et al (2016). So although the work is solid, the lack of originality lets it down. Minor comments: in 2.1, the word co-occurence measure - was any smoothing used to make this measure more robust to low counts?","The reviewer starts with positive remarks, highlighting the comprehensiveness, solidity, and practical usefulness of the experiments. They also praise the effectiveness of the proposed method. However, they express concerns about limited novelty and point out the lack of originality as a major drawback. The language remains constructive and professional throughout. Therefore, the sentiment leans towards the positive side, but the lack of novelty slightly lowers the score. The politeness remains high due to the constructive and professional tone.",60,80
"The paper shows how group convolutions (for two dimensional commutative groups) can be performed by standard CNNs if the input is warped using a fixed warp. The idea is practical and seems to work well. The paper is well written. I agree with reviewer 1 that the ‘theorems’ do not deserve to be labelled as such. Theorem 1 is equivalent to the second equation from this section of the wikipedia page on convolution: https://en.wikipedia.org/wiki/Convolution#Convolutions_on_groups. The existence of Haar measure (from which commutation of Lg and convolution follows immediately) is a well known and elementary theorem in harmonic analysis, which would be treated in the first few pages of any textbook on the subject. It also immediately clear that any commutative group has an additive parameterization (theorem 2). The fact that the paper does not present new deep mathematical results is not a significant weakness in my opinion, but the derivations should not be camouflaged as such. The claim that previous methods that use group convolutions are slow and that the presented approach has better computational complexity is not supported by empirical evidence, and the theoretical analysis is still a bit misleading. For example, the authors write “Unfortunately these approaches do not possess the same memory and speed benefits that CNNs enjoy. The reason is that, ultimately, they have to enumerate all possible transformations”. The presented method also has to enumerate all transformations (in a limited range, on a discretized grid), and this is feasible only because the group is only 2 dimensional (and indeed this is also true for standard CNNs which enumerate translations). As noted in my pre-review question, I believe the computational complexity analysis is not entirely correct, and assume the authors will correct this. Equation 4 is presented as a new invention, but this has been used in previous works and is well known in mathematics, so a citation should be added. The main advantage of the presented method over several earlier methods is that it is very simple to implement, and can re-use highly optimized convolution routines. As I understand it, Dieleman et al. and Cohen & Welling also use standard convolutions (after a fixed filter / feature map warp), but these papers only consider discrete groups. So it seems like this paper occupies a unique place in the space of equivariant convolutional networks: non-commutative (-), low-dimensional (-), continuous (+) groups, simple (+) and efficient (+) algorithm. Given the proximity though, a more thorough and balanced appraisal of the merits and demerits, as well as the novelty, relative to each of the previous works would be useful. Provided that these issues are cleared up, I would recommend the paper for publication.","The review is overall positive, recommending the paper for publication. However, it does raise several criticisms, mainly around the novelty of the theoretical contributions and the computational analysis. The reviewer finds the claims of novelty to be overstated and points out flaws in the computational complexity analysis. Despite the criticisms, the reviewer acknowledges the practical value, simplicity, and efficiency of the proposed method. The language used is direct and critical in places but maintains a professional and respectful tone.",60,50
"There have been numerous works on learning from raw waveforms and training letter-based CTC networks for speech recognition, however, there are very few works on combining both of them with purely ConvNet as it is done in this paper. It is interesting to see results on a large scale corpus such as Librispeech that is used in this paper, though some baseline results from hybrid NN/HMM systems should be provided. To readers, it is unclear how this system is close to state-of-the-art only from Table 2. The key contribution of this paper may be the end-to-end sequence training criterion for their CTC variant (where the blank symbol is dropped), which may be viewed as sequence training of CTC as H. Sak, et al. *Learning acoustic frame labeling for speech recognition with recurrent neural networks*, 2015. However, instead of generating the denominator lattices using a frame-level trained CTC model first, this paper directly compute the sequence-level loss by considering all the competing hypothesis in the normalizer. Therefore, the model is trained end-to-end. From this perspective, it is closely related to D. Povey*s LF-MMI for sequence-training of HMMs. As another reviewer has pointed out, references and discussions on that should be provided. This approach should be more expensive than frame-level training of CTCs, however, from Table 1, the authors* implementation is much faster. Did the systems there use the same sampling rate? You said at the end of 2.2 that the step size for your model is 20ms. Is it also the same for Baidu*s CTC system. Also, have you tried increasing the step size, e.g. to 30ms or 40ms, as people have found that it may work (equally) better, while significantly cut down the computational cost.","The review starts with acknowledging the novelty of the paper's approach in a relatively unexplored area. While it points out the need for baseline comparisons and clearer demonstration of state-of-the-art claims, the overall tone is constructive, suggesting improvements and further investigation rather than outright rejection. The reviewer poses specific questions and requests for clarification, indicating a desire to understand and potentially support the paper's contributions. The language remains professional and focused on the scientific content, without resorting to personal attacks or dismissive language.",50,75
"The paper conducts a detailed evaluation of different CNN architectures applied to image retrieval. The authors focus on testing various architectural choices, but do not propose or compare to end-to-end learning frameworks. Technically, the contribution is clear, particularly with the promised clarifications on how multiple scales are handled in the representation. However, I am still not entirely clear whether there would be a difference in the multi-scale settting for full and cropped queries. While the paper focuses on comparing different baseline architectures for CNN-based image retrieval, several recent papers have proposed to learn end-to-end representations specific for this task, with very good result (see for instance the recent work by Gordo et al. *End-to-end Learning of Deep Visual Representations for Image Retrieval*). The authors clarify that their work is orthogonal to papers such as Gordo et al. as they assess instead the performance of networks pre-trained from image classification. In fact, they also indicate that image retrieval is more difficult than image classification -- this is because it is performed by using features originally trained for classification. I can partially accept this argument. However, given the results in recent papers, it is clear than end-to-end training is far superior in practice and it is not clear the analysis developed by the authors in this work would transfer or be useful for that case as well.","The review starts with a relatively neutral tone, acknowledging the technical clarity and contribution of the paper. However, it then introduces concerns about the paper's relevance and potential impact, given the existence of more recent end-to-end learning approaches that outperform the methods evaluated in the paper. The reviewer acknowledges the authors' clarification about the orthogonal nature of their work but remains unconvinced about its usefulness in light of the superior performance of end-to-end learning. Therefore, the sentiment leans towards the negative side. The language used is polite and professional throughout, employing constructive criticism and avoiding harsh or disrespectful language.",-20,80
"Summary: In this paper, the authors introduce NoiseOut, a way to reduce parameters by pruning neurons from a network. They do this by identifying pairs of neurons produce the most correlated outputs, and replacing the pair by one neuron, and then appropriately adjusting weights. This technique relies on neurons having high correlations however, so they introduce an additional output neuron -- a noise output, which results in the network trying to predict the mean of the noise distribution. As this is a constant, it increases correlation between neurons. Experiments test this out on MNIST and SVHN Comments: This is an interesting suggestion on how to prune neurons, but more experiments (on larger datasets) are probably need to be convincing that this is an approach that is guaranteed to work well. Equation (5) seems to be very straightforwards? It seems like that for larger datasets, more noise outputs might have to be added to ensure higher correlations? Is there a downside to this in terms of the overall accuracy? The paper is presented clearly, and was definitely interesting to read, so I encourage the authors to continue this line of work.","The reviewer finds the paper interesting and encourages the authors to continue their work. They provide constructive criticism and suggestions for improvement, but also highlight the strengths like clear presentation. This suggests an overall positive sentiment, but not overly enthusiastic. The language is polite and professional throughout, with no signs of harsh criticism or disrespect.",60,80
