review,reasoning,sentiment_score,politeness_score
"Because the authors did not respond to reviewer feedback, I am maintaining my original review score. ----- This paper proposes to model relational (i.e., correlated) time series using a deep learning-inspired latent variable approach: they design a flexible parametric (but not generative) model with Gaussian latent factors and fit it using a rich training objective including terms for reconstruction (of observed time series) error, smoothness in the latent state space (via a KL divergence term encouraging neighbor states to be similarly distributed), and a final regularizer that encourages related time series to have similar latent state trajectories. Relations between trajectories are hard coded based on pre-existing knowledge, i.e., latent state trajectories for neighboring (wind speed) base stations should be similar. The model appears to be fit using gradient simple descent. The authors propose several elaborations, including a nonlinear transition function (based on an MLP) and a reconstruction error term that takes variance into account. However, the model is restricted to using a linear decoder. Experimental results are positive but not convincing. Strengths: - The authors target a worthwhile and challenging problem: incorporating the modeling of uncertainty over hidden states with the power of flexible neural net-like models. - The idea of representing relationships between hidden states using KL divergence between their (distributions over) corresponding hidden states is clever. Combined with the Gaussian distribution over hidden states, the resulting regularization term is simple and differentiable. - This general approach -- focusing on writing down the problem as a neural network-like loss function -- seems robust and flexible and could be combined with other approaches, including variants of variational autoencoders. Weaknesses: - The presentation is a muddled, especially the model definition in Sec. 3.3. The authors introduce four variants of their model with different combinations of decoder (with and without variance term) and linear vs. MLP transition function. It appears that the 2,2 variant is generally better but not on all metrics and often by small margins. This makes drawing a solid conclusions difficult: what each component of the loss contributes, whether and how the nonlinear transition function helps and how much, how in practice the model should be applied, etc. I would suggest two improvements to the manuscript: (1) focus on the main 2,2 variant in Sec. 3.3 (with the hypothesis that it should perform best) and make the simpler variants additional *baselines* described in a paragraph in Sec. 4.1; (2) perform more thorough experiments with larger data sets to make a stronger case for the superiority of this approach. - The authors only allude to learning (with references to gradient descent and ADAM during model description) in this framework. Inference gets its one subsection but only one sentence that ends in an ellipsis (?). - It*s unclear what is the purpose of introducing the inequality in Eq. 9. - Experimental results are not convincing: given the size of the data, the differences vs. the RNN and KF baselines is probably not significant, and these aren*t particularly strong baselines (especially if it is in fact an RNN and not an LSTM or GRU). - The position of this paper is unclear with respect to variational autoencoders and related models. Recurrent variants of VAEs (e.g., Krishnan, et al., 2015) seem to achieve most of the same goals as far as uncertainty modeling is concerned. It seems like those could easily be extended to model relationships between time series using the simple regularization strategy used here. Same goes for Johnson, et al., 2016 (mentioned in separate question). This is a valuable research direction with some intriguing ideas and interesting preliminary results. I would suggest that the authors restructure this manuscript a bit, striving for clarity of model description similar to the papers cited above and providing greater detail about learning and inference. They also need to perform more thorough experiments and present results that tell a clear story about the strengths and weaknesses of this approach.","The review starts with a neutral statement about maintaining the original score due to lack of author response. It then provides a factual summary of the paper's contributions. The reviewer acknowledges the strengths of the paper, such as addressing a relevant problem and using clever techniques. However, the reviewer also points out significant weaknesses, including a lack of clarity in presentation, unconvincing experimental results, and a lack of comparison with related work. The language used is critical but professional and not disrespectful. Overall, the sentiment leans towards the negative side due to the significant concerns raised.",-25,50
"The paper proposes a semantic embedding based approach to multilabel classification. Conversely to previous proposals, SEM considers the underlying parameters determining the observed labels are low-rank rather than that the observed label matrix is itself low-rank. However, It is not clear to what extent the difference between the two assumptions is significant SEM models the labels for an instance as draws from a multinomial distribution parametrized by nonlinear functions of the instance features. As such, it is a neural network. The proposed training algorithm is slightly more complicated than vanilla backprop. The significance of the results compared to NNML (in particular on large datasets Delicious and EUrlex) is not very clear. The paper is well written and the main idea is clearly presented. However, the experimental results are not significant enough to compensate the lack of conceptual novelty.","The review starts with a somewhat neutral tone, describing the paper's approach and comparing it to previous work. However, it expresses skepticism about the significance of the difference in assumptions. While acknowledging the clear writing and presentation, the reviewer ultimately finds the experimental results lacking and the conceptual novelty insufficient. This suggests an overall negative leaning.",-30,50
"The paper presents a large-scale visual search system for finding product images given a fashion item. The exploration is interesting and the paper does a nice job of discussing the challenges of operating in this domain. The proposed approach addresses several of the challenges. However, there are several concerns. 1) The main concern is that there are no comparisons or even mentions of the work done by Tamara Berg’s group on fashion recognition and fashion attributes, e.g., - “Automatic Attribute Discovery and Characterization from Noisy Web Data” ECCV 2010 - “Where to Buy It: Matching Street Clothing Photos in Online Shops” ICCV 2015, - “Retrieving Similar Styles to Parse Clothing, TPAMI 2014, etc It is difficult to show the contribution and novelty of this work without discussing and comparing with this extensive prior art. 2) There are not enough details about the attribute dataset and the collection process. What is the source of the images? Are these clean product images or real-world images? How is the annotation done? What instructions are the annotators given? What annotations are being collected? I understand data statistics for example may be proprietary, but these kinds of qualitative details are important to understand the contributions of the paper. How can others compare to this work? 3) There are some missing baselines. How do the results in Table 2 compare to simpler methods, e.g., the BM or CM methods described in the text? While the paper presents an interesting exploration, all these concerns would need to be addressed before the paper can be ready for publication.","The review starts with positive remarks, highlighting the interesting exploration and good discussion of domain challenges. However, it then raises several significant concerns about missing comparisons with prior work, lack of details about the dataset, and missing baselines. The overall tone is critical but professional and not disrespectful. Therefore, the sentiment leans slightly negative due to the depth of the concerns, while the politeness remains neutral.",-20,0
"The multiagent system is proposed as a generalization of neural network. The proposed system can be used with less restrictive network structures more efficiently by computing only those necessary computations in the graph. Unfortunately, I don*t find the proposed system different from the framework of artificial neural network. Although for today*s neural network structures are designed to have a lot of matrix-matrix multiplications, but it is not limited to have such architecture. In other words, the proposed multiagent system can be framed in the artificial neural network with more complicated layer/connectivity structures while considering each neuron as layer. The computation efficiency is argued among different sparsely connected denoising autoencoder in multiagent system framework only but the baseline comparison should be against the fully-connected neural network that employs matrix-matrix multiplication.","The reviewer finds the proposed system not significantly different from existing artificial neural networks, suggesting it's more of a reframing than a novel approach. They don't see sufficient evidence for the claimed computational efficiency. The language, while critical, maintains a professional and neutral tone. There's no personal attack or disrespectful wording.",-50,50
"This paper proposes to use a causality score to weight a sparsity regularizer. In that way, selected variables trade off between being causal and discriminative. The framework is primarily evaluated on a proprietary health dataset. While the dataset does give a good motivation to the problem setting, the paper falls a bit short for ICLR due to the lack of additional controlled experiments, relatively straightforward methodology (given the approach of Chalupka et al., arXiv Preprint, 2016, which is a more interesting paper from a technical perspective), and paucity of theoretical motivation. At the core of this paper, the approach is effectively to weight a sparsity regularizer so that *causal* variables (as determined by a separate objective) are more likely to be selected. This is generally a good idea, but we do not get a proper validation of this from the experiments as ground truth is absent. A theorem on identifiability of causal+discriminative variables from a data sample combined with adequate synthetic experiments would have probably been sufficient, for example, to push the paper towards accept from a technical perspective, but as it is, it is lacking in insight and reproducibility.","The review starts with a neutral statement, presenting the paper's proposal. However, it quickly transitions into a negative sentiment, using phrases like ""falls a bit short"", ""relatively straightforward methodology"", ""lack of"", and ""paucity of"". While the reviewer acknowledges the good idea, they find the execution and validation lacking. The criticism, though direct, maintains a professional and analytical tone without resorting to personal attacks or disrespectful language.",-40,60
"The authors seems to have proposed a genetic algorithm for learning the features of a convolutional network (LeNet-5 to be precise). The algorithm is validated on some version of the MNIST dataset. Unfortunately the paper is extremely hard to understand and it is not at all clear what the exact training algorithm is. Neither do the authors ever motivate why do such a training as opposed to the standard back-prop. What are its advantages/dis-advantages? Furthermore the experimental section is equally unclear. The authors seem to have merged the training and validation set of the MNIST dataset and use only a subset of it. It is not clear why is that the case and what subset they use. In addition, to the best of my understanding, the results reported are RMSE as opposed to classification error. Why is that the case? In short, the paper is extremely hard to follow and it is not at all clear what the training algorithm is and how is it better than standard way of training. The experimental section is equally confusing and unconvincing. Other comments: -- The figures still say LeCun-5 -- The legends of the plots are not in english. Hence I*m not sure what is going on there. -- The paper is riddled with typos and hard to understand phrasing.","The review is highly critical of the paper, pointing out major flaws in clarity, methodology, and results. The reviewer uses strong negative phrasing like ""extremely hard to understand,"" ""not at all clear,"" ""equally confusing and unconvincing."" This indicates a significantly negative sentiment. While the reviewer uses harsh wording, it doesn't cross into personal attacks or disrespectful language, staying within the bounds of academic criticism.",-80,-20
"This paper proposes a k-shot learning framework that can be used on existing pre-trained networks by grouping filters that produce similar activations. The grouped filters are learned together to address overfitting when only few training samples are available. The idea of the paper is interesting there are some encouraging results, but the current version doesn*t seem ready for publication: Performance: The method should be compared with other state-of-the-art k-shot learning methods (e.g., Matching Networks by Vinyals et al., 2016). It*s not clear how this method compares against them. Missing explanation: Experimental setting for k-shot learning should be more detailed. Measure: Accuracy difference does not look like a good idea for comparing the baseline method and the proposed one. Just raw accuracies would be fine. Many grammatical errors and inappropriate formatting of citations, such as: M. et al. (2011) ImageNet (Alex et al. (2012)) Judy et al. (2013): this reference appears three times in the reference section.","The review acknowledges the paper's interesting idea and encouraging results, suggesting a positive sentiment. However, it points out significant weaknesses in the experimental setup, comparison with existing methods, and presentation, indicating that the paper is not ready for publication. This suggests the sentiment is rather mixed, leaning towards the negative due to the need for major improvements. The language used is direct and critical, typical of academic peer reviews, but maintains a professional and respectful tone without resorting to personal attacks or harsh language.",-20,60
"This paper introduces a neural network architecture and training procedure for predicting the speed of a vehicle several seconds into the future based on video and vehicle state input. The architecture allows several RNNs to compete to make the best predictions, with only the best prediction receiving back propagation training at each time step. Preliminary experimental results show that this scheme can yield reduced prediction error. It is not clear how the best-performing RNN is chosen for each time point at test time. That is, how is the “integrated prediction” obtained in Fig. 7? Is the prediction the one with minimum error over all of the output layers? If so, this means the prediction cannot be made until you already know the value to be predicted. It seems possible that a larger generic RNN might be able to generate accurate predictions. If I understand correctly, the competitive architectures have many more parameters than the baseline. Is the improved performance here due to the competitive scheme, or just a larger model? A large amount of additional work is required to sustain the claim that this scheme is successfully extracting driver ‘intentions’. It would be interesting to see if the scheme, suitably extended, can automatically infer the intention to stop at a stop sign vs slowing but not stopping due to a car in front, say, or to pass a car vs simply changing lanes. Adding labels to the dataset may enable this comparison more clearly. More generally, the intention of the driver seems more related to the goals they are pursuing at the moment; there is a fair amount of work in inverse reinforcement learning that examines this problem (some of it in the context of driving style as well).","The review is cautiously positive. It acknowledges the potential of the proposed architecture and the promising preliminary results (""this scheme can yield reduced prediction error""). However, it also raises several important questions and suggests further experiments and comparisons to validate the claims and explore the full potential of the approach. The reviewer maintains a neutral and professional tone throughout, focusing on the scientific aspects of the work.",50,70
"This paper investigates whether the variational inference interpretation of dropout, as introduced in [Gal & Ghahramani (2016), and Kingma et al (2015)], can lead to good estimates of mode uncertainty outside of the training distribution. This is an area of research that indeed warrants more experimental investigation. One very interesting finding is that MC integration leads to much calibration, thus probably much better out-of-sample prediction, than the more usual. Critique: - As explained in Kingma et al (2015), when using continuous posterior distributions over the weights, the dropout rate can be optimized, leading to better regularization. While the paper is cited in the introduction, this adaptive form of dropout is missing from experiments, without clarification. - Only the dropout rate p=0.5 was used across experiments, while the optimal rate is problem dependent, as found by earlier published work. - No new ideas are presented, and the analysis in the paper is quite limited. As it stands, this would be more appropriate for a workshop.","The review starts with a positive note, acknowledging the relevance of the research topic and highlighting an interesting finding (calibrated MC integration). However, it then presents three main critiques, suggesting the paper lacks novelty and depth ('No new ideas...', '...analysis in the paper is quite limited'), and points out methodological limitations. The comment about the paper being more appropriate for a workshop suggests the reviewer sees potential but considers the work not yet ready for a full publication. Therefore, the sentiment is mixed, leaning towards the negative due to the critical points raised. The language used is formal, technical, and devoid of personal attacks, indicating a professional and polite tone.",-25,50
"The paper proposes a modified DAE objective where it is the mapped representation of the corrupted input that is pushed closer to the representation of the uncorrupted input. This thus borrows from both denoising (DAE) for the stochasticity and from the contractive (CAE) auto-encoders objectives (which the paper doesn’t compare to) for the representational closeness, and as such appears rather incremental. In common with the CAE, a collapse of the representation can only be avoided by additional external constraints, such as tied weights, batch normalization or other normalization heuristics. While I appreciates that the authors added a paragraph discussing this point and the usual remediations after I had raised it in an earlier question, I think it would deserve a proper formal treatment. Note that such external constraints do not seem to arise from the information-theoretic formalism as articulated by the authors. This casts doubt regarding the validity or completeness of the proposed formal motivation as currently exposed. What the extra regularization does from an information-theoretic perspective remains unclearly articulated (e.g. interpretation of lambda strength?). On the experimental front, empirical support for the approach is very weak: few experiments on synthetic and small scale data. The modified DAE*s test errors on MNIST are larger than those of Original DAE all the time expect for one precise setting of lambda, and then the original DAE performance is still within the displayed error-bar of the modified DAE. So, it is unclear whether the improvement is actually statistically significant.","The review is critical of the paper's novelty, theoretical grounding, and experimental validation. The reviewer finds the proposed method to be incremental and lacking strong empirical support. While they acknowledge the authors' efforts to address concerns about representational collapse, they find the theoretical explanation and the experimental results to be unconvincing. The language used, while direct, maintains a professional and academic tone.",-50,50
"My main objection with this work is that it operates under a hypothesis (that is becoming more and more popular in the literature) that all we need is to have gradients flow in order to solve long term dependency problems. The usual approach is then to enforce orthogonal matrices which (in absence of the nonlinearity) results in unitary jacobians, hence the gradients do not vanish and do not explode. However this hypothesis is taken for granted (and we don*t know it is true yet) and instead of synthetic data, we do not have any empirical evidence that is strong enough to convince us the hypothesis is true. My own issues with this way of thinking is: a) what about representational power; restricting to orthogonal matrices it means we can not represent the same family of functions as before (e.g. we can*t have complex attractors and so forth if we run the model forward without any inputs). You can only get those if you have eigenvalues larger than 1. It also becomes really hard to deal with noise (since you attempt to preserve every detail of the input, or rather every part of the input affects the output). Ideally you would want to preserve only what you need for the task given limited capacity. But you can*t learn to do that. My issue is that everyone is focused on solving this preserved issue without worrying of the side-effects. I would like one of these papers going for jacobians having eigenvalues of 1 show this helps in realistic scenarios, on complex datasets.","The reviewer expresses a strong negative sentiment by stating a fundamental disagreement with the core hypothesis of the paper and the popular approach in the field. They back their argument with several points and call for empirical evidence instead of just relying on theoretical assumptions. While they point out flaws and express doubts, the language remains technical and doesn't resort to personal attacks.",-75,50
"This paper aims to mine explicit rules from KB embedding space, and casts it into a sparse reconstruction problem. Experiments demonstrate its ability of extracting reasonable rules on a few link prediction datasets. The solution part sounds plausible. However, it confuses me that why we need to mine rules from learned KB embeddings. - It is still unclear what information these KB embeddings encode and it looks strange that we aim to learn rules including negation / disjunction from them. - If the goal is to extract useful rules (for other applications), it is necessary to compare it to “graph random walk” (http://rtw.ml.cmu.edu/papers/lao-emnlp11.pdf) which could learn rules from KB graph directly. - As there is only one KNN baseline, the experimental results seem pretty weak. At the least, it is necessary to show the original precision / recall of RESCAL, together with the proposed rule mining approach (with different max length), so we know how much the current information the current rule miner could recover. In addition, the four datasets are all very small. Would it be able to scale it to WordNet or Freebase? [Minor comments] “Relational embedding” and “relation embedding” are used mixedly throughout the paper. I am not sure if they are well-defined terms (it is better to cite relevant paper).","The reviewer finds the solution plausible but has major concerns and expresses confusion about the approach. They find the experimental results weak and call for more comparisons and larger datasets. The reviewer also points out inconsistencies in terminology. The tone is critical but professional, suggesting areas for improvement rather than outright rejection.",-20,50
