review,reasoning,sentiment_score,politeness_score
"This paper is refreshing and elegant in its handling of *over-sampling* in VAE. Problem is that good reconstruction requires more nodes in the latent layers of the VAE. Not all of them can or should be sampled from at the *creative* regime of the VAE. Which ones to choose? The paper offers and sensible solution. Problem is that real-life data-sets like CIFAR have not being tried, so the reader is hard-pressed to choose between many other, just as natural, solutions. One can e.g. run in parallel a classifier and let it choose the best epitome, in the spirit of spatial transformers, ACE, reference [1]. The list can go on. We hope that the paper finds its way to the conference because it addresses an important problem in an elegant way, and papers like this are few and far between! On a secondary note, regarding terminology: Pls avoid using *the KL term* as in section 2.1, there are so many *KL terms* related to VAE-s, it ultimately gets out of control. *Generative error* is a more descriptive term, because minimizing it is indispensable for the generative qualities of the net. The variational error for example is also a *KL term* (equation (3.4) in reference [1]), as is the upper bound commonly used in VAE-s (your formula (5) and its equivalent - the KL expression as in formula (3.8) in reference [1]). The latter expression is frequently used and is handy for, say, importance sampling, as in reference [2]. [1] https://arxiv.org/pdf/1508.06585v5.pdf [2] https://arxiv.org/pdf/1509.00519.pdf","The review starts with very positive words like ""refreshing"", ""elegant"", and ""sensible solution"". The reviewer acknowledges the importance of the paper's contribution. However, they also express some reservations, mainly the lack of experiments on real-life datasets and suggest alternative approaches. The tone is quite positive overall, with constructive criticism. The reviewer clearly wants to see the paper published but suggests some improvements.",60,70
"This paper performs a series of experiments to systematically evaluate the robustness of several defense methods, including RAD, AEC and its improved version etc.. It provides interesting observations. Overall, RAD and distillation have the best performances, but none of the methods can really resist the *additional* attack from cg or adam. Since it is an experimental paper, my main concern is about its clarity. See the comments below for details. Pros: 1. This paper provides a good comparison of the performances for the selected methods. 2. Section 3.3 (the *additional* attack) is a interesting investigation. Although the final result about the defense methods is negative, its results are still inspiring. 3. Overall, this paper provides interesting and inspiring experimental results about the selected methods. Cons: 1. There are several other methods in the literature that are missing from the paper. For example the defense methods and the attack methods in the papers [1,2]. 2. Although a long list of experimental results are provided in the paper, many details are skipped. For example, details of the experiments that generate the results in Table 5. 3. Without further explanations and analyses about the experimental results, the contribution of the paper seems limited. 4. This paper proposed an improved version of the AEC algorithm. But its experimental results seems not promising. Minor comments: Page 3: Equation (3) is also non-convex. So the non-convexity of Equation (2) should not be the motivation of Equation (3). [1] https://arxiv.org/abs/1507.00677 [2] https://arxiv.org/abs/1511.03034","The reviewer provides both positive and negative points for the paper. They find the experiments and observations interesting, particularly highlighting the investigation in Section 3.3. However, they also express concerns about the clarity, missing related work, and lack of detailed analysis. The tone is critical but professional and aims to improve the paper. Therefore, the sentiment leans slightly towards the positive side due to the acknowledged interesting results, and the politeness remains neutral.",20,0
"The topic is very interesting, but the paper is not convincing. Specifically, the experiment part is weak. The study should include datasets that are familiar to the community as well as the ones *that are not often addressed by deep learning*. The comparison to other approaches is not comprehensive.","The review starts with a positive statement acknowledging the interesting topic. However, it quickly transitions to negative criticism about the paper's weaknesses, particularly the experimental part. The reviewer uses phrases like ""not convincing"" and points out specific flaws. The suggestion to include datasets ""*that are not often addressed by deep learning*"" hints at a need for broader contribution. Overall, the negative aspects outweigh the initial positive remark.",-40,60
"This paper aims to characterize the perceptual ability of a neural network under different input conditions. This is done by manipulating the input image x in various ways (e.g. downsamplig, foveating), and training an auto-encoder to reconstruct the original full-resolution image. MSE and qualitative results are shown and compared for the different input conditions. Unfortunately, this paper seems to lack focus, presenting a set of preliminary inspections with few concrete conclusions. For example, at the end of sec 4.4, *This result is not surprising, given that FOV-R contains additional information .... These results suggests that a small number of foveations containing rich details might be all these neural networks need....*. But this hypothesis is left dangling: What detailed regions are needed, and from where? For what sort of tasks? Secondly, it isn*t clear to me what reconstruction behaviors are caused by a fundamental perception of the input, and what are artifacts of the autoencoder and pixelwise l2 loss? A prime example is texture, which the autoencoder fails to recover. But with a pixelwise loss, the network must predict high-frequency textures nearly pixel-for-pixel at training time; if this is impossible, then it will generate a pixelwise average of the training samples --- a flat region. So then the network*s inability to reconstruct textures is due to a problem generating them, specifically averaging from the training loss, not necessarily an issue in perceiving textures. A network trained a different way (perhaps an adversarial network) may infer a texture is there, even if it wouldn*t be able to generate it in a pixelwise l2 sense. Similarly, the ability to perform color reconstruction given a color glimpse I think has much to do with disambiguating the color of an object/scene: If there is an ambiguity, the network won*t know which to *choose* (white flower or yellow flower?) and output an average, which is why there are so many sepia tones. However, in its section on this, the paper only measures the reconstruction error for different amounts of color given, and does not drill very far into any hypotheses for why this behavior occurs. There are some interesting measurements here, such as the amount of color needed in the foveation to reconstruct a color image, and the discussion on global features, which may start to get at a mechanism by which glimpses may propagate to an entire reconstruction. But overall it*s hard to know what to take away from this paper. What are larger concrete conclusions that can be garnered from the details, and what mechanisms bring them about? Can these be more thoroughly explored with more focus?","The reviewer acknowledges some interesting measurements and discussions but ultimately finds the paper lacking focus and concrete conclusions. The reviewer points out specific instances where hypotheses are presented but not thoroughly explored, leading to an overall sense of uncertainty about the paper's takeaways. The language used, while critical, maintains a professional and analytical tone.",-20,60
"First I would like to apologize for the delay in reviewing. summary : This work explores several experiments to transfer training a specific model of reading comprehension ( AS Reader), in an artificial and well populated dataset in order to perform in another target dataset. Here is what I understand are their several experiments to transfer learning, but I am not 100% sure. 1. The model is trained on the big artificial dataset and tested on the small target datasets (section 4.1) 2. The model is pre-trained on the big artificial dataset like before, then fine-tuned on a few examples from the target dataset and tested on the remaining target examples. Several such models are trained using different sub-sets of fine-tuning examples. The results are tested against the performance of randomly intialized then fine-tuned models (section 4.2). 3. The model is pre-trained on the big artificial dataset like before. The model is made of an embedding component and an encoder component. Alternatively, each component is reset to a random initialization, to test the importance of the pre-training in each component. Then the model is fine-tuned on a few examples from the target dataset and tested on the remaining target examples. (section 4.3) I think what makes things difficult to follow is the fact that the test set is composed by several sub tasks, and sometimes what is reported is the mean performance across the tasks, sometimes the performance on a few tasks. Sometimes what we see is the mean performance of several models? You should report standard deviations also. Could you better explain what you mean by best validation ? Interesting and unpretentious work. The clarity of the presentation could be improved maybe by simplifying the experimental setup? The interesting conclusion I think is reported at the end of the section 4.1, when the nuanced difference between the datasets are exposed. Minor: unexplained acronyms: GRU, BT, CBT. benfits p. 2 subsubset p. 6","The reviewer acknowledges the work as ""interesting"" and ""unpretentious"", suggesting a generally positive view. However, they also express some confusion and suggest improvements in clarity and reporting. The criticism is presented constructively, focusing on areas for improvement rather than outright negativity. Therefore, the sentiment leans slightly positive, but not overwhelmingly so. The language used is polite and professional throughout, with no instances of harsh or disrespectful language.",60,80
"The paper proposes the group sparse autoencoder that enforces sparsity of the hidden representation group-wise, where the group is formed based on labels (i.e., supervision). The p-th group hidden representation is used for reconstruction with group sparsity penalty, allowing learning more discriminative, class-specific patterns in the dataset. The paper also propose to combine both group-level and individual level sparsity as in Equation (9). Clarity of the paper is a bit low. - Do you use only p-th group*s activation for reconstruction? If it is true, then for Equation (9) do you use all individual hidden representation for reconstruction or still using the subset of representation corresponding to that class only? - In Equation (7), RHS misses the summation over p, and wondering it is a simple typo. - Is the algorithm end-to-end trainable? It seems to me that the group sparse CNN is no more than the GSA whose input data is the feature extracted from sequential CNNs (or any other pretrained CNNs). Other comments are as follows: - Furthermore the group sparse autoencoder is (semi-) supervised method since it uses label information to form a group, whereas the standard sparse autoencoder is fully unsupervised. That being said, it is not surprising that group sparse autoencoder learns more class-specific pattern whereas sparse autoencoder doesn*t. I think the fair comparison should be to autoencoders that combines classification for their objective function. - Although authors claim that GSA learns more group-relevant features, Figure 3 (b) is not convincing enough to support this claim. For example, the first row contains many filters that doesn*t look like 1 (e.g., very last column looks like 3). - Other than visual inspection, do you observe improvement in classification using proposed algorithm on MNIST experiments? - The comparison to the baseline model is missing. I believe the baseline model shouldn*t be the sequential CNN, but the sequential CNN + sparse autoencoder. In addition, more control experiment is required that compares between the Equation (7)-(9), with different values of alpha and eta. Missing reference: Shang et al., Discriminative Training of Structured Dictionaries via Block Orthogonal Matching Pursuit, SDM 2016 - they consider block orthgonal matching pursuit for dictionary learning whose blocks (i.e., projection matrices) are constructed based on the class labels for discirminative training.","The review starts with a neutral statement, summarizing the paper's proposal. However, it quickly points out a lack of clarity and raises several questions and concerns. The reviewer challenges the paper's claims and suggests alternative approaches and comparisons. The tone, while direct and critical, maintains a professional and constructive approach. The reviewer offers specific suggestions for improvement, indicating a desire to see the paper strengthened. Overall, the sentiment leans towards the negative side due to the numerous concerns raised.",-30,50
"The paper proposed a very complex compression and reconstruction method (with additional parameters) for reducing the memory footprint of deep networks. The authors show that this complex proposal is better than simple hashed net proposal. One question: Are you also counting the extra parameters for reconstruction network for the memory comparison? Otherwise, the experiments are unfair. Since hashing and reconstruction cost will dominate the feed-forward and back-propagation updates, it is imperative to compare the two methods on running time. For hashed net, this is quite simple, yet it created an additional bottleneck. Please also show the impact on running time. Small improvements for a big loss in computational cost may not be acceptable. I am not convinced that this method will be lightweight. If we are allowed complicated compression and reconstruction then we can use any off-shelf methods, but the cost will be huge","The reviewer expresses skepticism and doubt about the proposed method's efficiency. They point out a potential flaw in the experimental comparison ('unfair') and demand further experiments regarding running time. The phrase 'I am not convinced' indicates a negative sentiment. While the reviewer poses critical questions, they don't use any directly offensive or rude language.",-50,50
"The paper tests various feedforward network architectures for supervised training to predict a human’s next move, given a board position. It trains on human play data taken from KGX, augmenting the data by considering all 8 rotations/reflections of each board position. The paper’s presentation is inefficient and muddled, and the results seem incremental. Presentation: The abstract and introduction point out that AlphaGo requires many RL iterations to train, and propose to improve this by swapping out the policy network with one that is more amenable to training. However, the paper only presents supervised learning results, not RL. While it’s not unreasonable to assume that a higher-capacity network that shows improvements in supervised learning will also yield dividends in RL, it’s still unsatisfying to be presented with SL improvements and be asked to assume that the RL improvements will be of a similar magnitude, whatever that may mean. It would’ve been more convincing to train both AlphaGo and this paper*s architectures on an equal number of RL self-play iterations, then have them play each other. (Both would be pre-trained using supervised training, as per the AlphaGo paper). It is not until section 3.3 that it is clearly stated this is strictly a supervised-learning paper. This should have been put front and center in the abstract and introduction. Fully 3 pages are spent on giant but simple architecture diagrams. This is both extravagant and muddles the exposition. It seems better to show just the architectures used in the experiments, and spend at most half a page doing so, so that they may be seen alongside one another. The results (Table 1, Figures 7 and 8) are hard to skim, as there is little information in the captions, and the graph axes are poorly labeled. For example, I assume “Examples” in figures 7 and 8 should be “Training examples”, and the number of training examples isn’t 0-50, but some large multiple thereof. Results: The take-home seems to be that that deeper networks do better, and residual architectures and spatial batch normalization each improve the results in this domain, as they are known to do in others. Furthermore, we are asked to assume that the improvements in an RL setting will be similar to the improvements in SL shown here. These results seem too incremental to justify an ICLR publication.","The review is critical of the paper's presentation, clarity, and significance of results. It points out missing information, inefficient use of space, and questions the validity of extrapolating supervised learning improvements to reinforcement learning. While the reviewer doesn't resort to personal attacks or overly negative language, the tone is quite critical and suggests the paper needs significant revisions. ",-50,50
"This paper empirically studies the invariance, equivariance and equivalence properties of representations learned by convolutional networks under various kinds of data augmentation. Additional loss terms are presented which can make a representation more invariant or equivariant. The idea of measuring invariance, equivariance and equivalence of representations is not new (Lenc & Vedaldi). The authors are the first to systematically study the effect of data augmentation on these properties, but it is unclear in what way the results are surprising, interesting, or useful. It is not really surprising that data augmentation increases invariance, or that training with the same augmentation leads to more similar representations than training with different augmentations. Regarding the presented method to increase invariance and equivariance: while it could be that a representation will generalize better if it is invariant or equivariant, it is not clear why one would want to increase in/equivariance if it does not indeed lead to improvements in performance. The paper presents no evidence that training for increased invariance / equivariance leads to substantial improvements in performance. Combined with the fact that the loss (eq. 6) would substantially increase the computational burden, I don’t think this technique will be very useful. Minor comments: -R^{nxn} should be R^{n 	imes n} -In eq. 2: ‘equivaraince’ -In 3.3, argmax is not properly formatted -I think data augmentation was already considered essential before Krizhevsky et al. Not really correct to attribute this to them. - About the claim “This is related to the idea of whether CNNs collapse (invariance) or linearize (equivariance) view manifolds of 3D objects”. The idea that equivariance means that the manifold (orbit) is linearized, is incorrect. A linear representation M_g can create nonlinear manifolds. A simple example is given by a rotation matrix in 2D (clearly linear), generating a nonlinear manifold (the circle). - Equivariance in eq. 2 should be called “non-equivariance”. If the value is low, the representation is equivariant, while if it is high it is non-equivariant. - “Eq. 2 also uses the paradigm that”, uses the word paradigm in a strange manner - In the definition of x’_ij, should one of the g_j be inverted? Otherwise it seems like the transformation is applied twice, instead of being undone.","The review is critical of the paper's novelty and usefulness. While acknowledging the systematic study of data augmentation effects, the reviewer finds the results unsurprising and questions the practicality of the proposed method due to its computational burden and lack of performance improvement evidence. The language, while direct and critical, maintains a professional and constructive tone, pointing out specific areas for improvement without resorting to personal attacks or disrespectful language.",-30,60
This paper theoretically justified a faster convergence (in terms of average gradient norm attained after processing a fixed number of samples) of using small mini-batches for SGD or ASGD with smaller number of learners. This indicates that there is an inherent inefficiency in the speed-up obtained with parallelizing gradient descent methods by taking advantage of hardware. This paper looks good overall and makes some connection between algorithm design and hardware properties. My main concern is that Lemma 1 looks incorrect to me. The factor D_f / S should be D_f/ (S*M) for me. Please clarify this and check the subsequent theorem.,"The review starts with positive statements, highlighting the paper's contribution and overall quality. While it points out a concern about a potential error, the reviewer does so constructively and maintains a professional tone. The language used is polite and objective.",60,80
